{
  "$schema": "http://json-schema.org/draft-07/schema#",
  "$id": "https://github.com/PiNetwork/PiRC/pull/2#engagement-event-v1",
  "title": "PEP Engagement Event Envelope v1",
  "description": "Closed schema for a signed engagement event reported by a dApp backend. The normative validator is src/schema.js; this document is an interoperable description of the same contract.",
  "type": "object",
  "additionalProperties": false,
  "required": [
    "v",
    "app_id",
    "key_id",
    "action_class",
    "action_id",
    "weight",
    "timestamp",
    "nonce",
    "pioneer_uid_hash",
    "eligibility",
    "signature"
  ],
  "properties": {
    "v": { "const": 1, "description": "Spec version." },
    "app_id": {
      "type": "string",
      "pattern": "^[a-z0-9][a-z0-9-]{2,63}$",
      "description": "Registered application identifier."
    },
    "key_id": {
      "type": "string",
      "pattern": "^[a-zA-Z0-9][a-zA-Z0-9._-]{0,63}$",
      "description": "Backend signing key version registered for this app. Enables rotation without downtime."
    },
    "action_class": {
      "enum": ["A", "B", "C"],
      "description": "Utility class. A = high utility, B = medium, C = basic activity. Each class carries a hard weight ceiling."
    },
    "action_id": {
      "type": "string",
      "pattern": "^[a-z0-9][a-zA-Z0-9._:-]{1,127}$",
      "description": "App-defined milestone identifier within the declared class."
    },
    "weight": {
      "type": "integer",
      "minimum": 1,
      "maximum": 100,
      "description": "Signed utility weight. Must not exceed the class ceiling (A=100, B=10, C=1) enforced by the verifier regardless of the signature's validity."
    },
    "timestamp": {
      "type": "integer",
      "minimum": 1,
      "description": "Unix milliseconds at event creation. Verifier accepts only within +/- TIMESTAMP_WINDOW_MS of its own clock."
    },
    "nonce": {
      "type": "string",
      "pattern": "^[0-9a-f]{32}$",
      "description": "16 random bytes (hex). Globally namespaced per app_id; recorded only when the full pipeline passes."
    },
    "pioneer_uid_hash": {
      "type": "string",
      "pattern": "^[0-9a-f]{64}$",
      "description": "sha256 of the Pi UID (optionally salted). The raw UID never leaves the backend."
    },
    "eligibility": {
      "type": "object",
      "additionalProperties": false,
      "required": ["kyc_passed", "mainnet_migrated"],
      "properties": {
        "kyc_passed": { "type": "boolean" },
        "mainnet_migrated": { "type": "boolean" }
      },
      "description": "Self-declared eligibility flags, signed by the backend AND cross-checked against the launchpad-side eligible-users registry."
    },
    "signature": {
      "type": "string",
      "contentEncoding": "base64",
      "pattern": "^[A-Za-z0-9+/]{85}[AQgw]==$",
      "description": "Ed25519 signature (64 bytes) over PiRC1-PEP-v1\\n + canonical JSON of the envelope with the signature field removed."
    }
  }
}
